{
  "format": "myshare-operator-exchange",
  "version": 3,
  "exported_at": "2026-08-21T10:30:00+08:00",
  "catalog_version": "operators-2026-08-21",
  "producer": {
    "platform": "yuanhub",
    "version": "3"
  },
  "accounts": [
    {
      "id": "acc_demo",
      "name": "大号",
      "game_scope": "如鸢"
    }
  ],
  "records": [
    {
      "account_id": "acc_demo",
      "record_id": "backup:annotations:discarded:20261003",
      "record_type": "operator_annotation_snapshot",
      "game": "如鸢",
      "effective_at": "2026-08-21T10:30:00+08:00",
      "snapshot_scope": "listed",
      "source_kind": "backup",
      "entries": [
        {
          "operator_id": "char_012_yanliang",
          "growth_state": "discarded"
        }
      ]
    }
  ]
}
